{
  "id": "sol.nt.linear-diophantine-parametrization",
  "entity_type": "solution",
  "schema_version": "1.0.0",
  "status": "published",
  "target_ref": {
    "entity_type": "example",
    "id": "ex.nt.linear-diophantine-parametrization"
  },
  "solution_kind": "full",
  "solution_status": "complete",
  "body": {
    "source_format": "markdown",
    "plain_text": "Divide by 6 to get 3x + 5y = 1. One easy solution is x = 2, y = -1. Since gcd(3,5)=1, the full family is x = 2 + 5t and y = -1 - 3t.",
    "markdown": "Divide by $6$ to get $3x + 5y = 1$. One easy solution is $(x,y)=(2,-1)$. Since $\\gcd(3,5)=1$, the full family is $x = 2 + 5t$ and $y = -1 - 3t$."
  },
  "tracking_profile": {
    "is_trackable": false,
    "mastery_weight": 0,
    "review_priority": "low",
    "completion_criteria": ["understand"],
    "estimated_effort_minutes": 8
  },
  "title": "Worked Solution",
  "step_blocks": [
    {
      "index": 1,
      "heading": "Normalize",
      "content": {
        "source_format": "markdown",
        "plain_text": "Divide both sides by the gcd to simplify the equation.",
        "markdown": "Divide both sides by the gcd to simplify the equation."
      },
      "uses_refs": [
        {
          "entity_type": "theorem",
          "id": "thm.nt.linear-diophantine-solvability"
        }
      ]
    },
    {
      "index": 2,
      "heading": "Parameterize",
      "content": {
        "source_format": "markdown",
        "plain_text": "From one particular solution, add the homogeneous step sizes 5 and -3.",
        "markdown": "From one particular solution, add the homogeneous step sizes $5$ and $-3$."
      },
      "uses_refs": [
        {
          "entity_type": "technique",
          "id": "tech.nt.solve-linear-diophantine-via-gcd"
        }
      ]
    }
  ],
  "final_answer": {
    "source_format": "dual",
    "plain_text": "x = 2 + 5t and y = -1 - 3t.",
    "markdown": "$x = 2 + 5t$ and $y = -1 - 3t$.",
    "latex": "x=2+5t,\\ y=-1-3t"
  },
  "used_theorem_ids": [
    "thm.nt.bezout-identity",
    "thm.nt.linear-diophantine-solvability"
  ],
  "used_technique_ids": ["tech.nt.solve-linear-diophantine-via-gcd"],
  "is_official": false,
  "audit": {
    "created_at": "2026-03-09T08:25:00Z",
    "updated_at": "2026-03-09T08:25:00Z",
    "created_by": "seed.bot",
    "updated_by": "seed.bot"
  }
}
