{
  "id": "sol.nt.sum-two-squares-mod4",
  "entity_type": "solution",
  "schema_version": "1.0.0",
  "status": "published",
  "target_ref": {
    "entity_type": "problem",
    "id": "prob.nt.sum-two-squares-mod4"
  },
  "solution_kind": "full",
  "solution_status": "complete",
  "body": {
    "source_format": "markdown",
    "plain_text": "Squares are 0 or 1 mod 4, so a sum of two squares is 0,1,2 mod 4, never 3.",
    "markdown": "Squares are $0$ or $1 \\pmod 4$, so a sum of two squares is $0,1,2 \\pmod 4$, never $3$."
  },
  "tracking_profile": {
    "is_trackable": true,
    "mastery_weight": 0.8,
    "review_priority": "normal",
    "completion_criteria": [
      "read",
      "understand",
      "apply"
    ],
    "estimated_effort_minutes": 20
  },
  "final_answer": {
    "source_format": "markdown",
    "plain_text": "No integer solutions exist.",
    "markdown": "No integer solutions exist."
  },
  "audit": {
    "created_at": "2026-03-08T10:00:00Z",
    "updated_at": "2026-03-08T10:05:00Z",
    "created_by": "system.seed",
    "updated_by": "system.seed"
  }
}
